<?xml version="1.0"?>
<!--
/**
 * @copyright: Copyright Â© 2017 Firebear Studio. All rights reserved.
 * @author   : Firebear Studio <fbeardev@gmail.com>
 */
-->
<config xmlns:xsi="http://www.w3.org/2001/XMLSchema-instance" xsi:noNamespaceSchemaLocation="source_types.xsd">
    <type name="file" label="File" modelInstance="Firebear\ImportExport\Model\Source\Type\File" sortOrder="10">
        <field name="file_path" id="file_path" label="File Path" type="text" required="true"
               notice="The file must match the format. Use relative path to Magento installation, e.g. var/import/products.csv (Make sure folder have correct write permissions - 775 , for more details please see Magento 2 Permissions guide)"
               validation="no-whitespace" component="Firebear_ImportExport/js/form/export-path-file"/>
        <field name="date_format" id="date_format" value="Y-m-d-hi" label="Date Format" type="text"
               notice="Date format to attach at end of the file. Enter php date format default is 'Y-m-d-hi'." component="Firebear_ImportExport/js/form/export-path-file"/>
    </type>
    <type name="ftp" label="Ftp" modelInstance="Firebear\ImportExport\Model\Source\Type\Ftp" sortOrder="20">
        <field name="file_path" id="file_path" label="File Path" type="text" required="true"
               notice="The file must match the format. Use relative path to Magento installation, e.g. var/import/products.csv (Make sure folder have correct write permissions - 775 , for more details please see Magento 2 Permissions guide)"
               validation="no-whitespace" component="Firebear_ImportExport/js/form/export-path-file"/>
        <field name="date_format" id="date_format" value="Y-m-d-hi" label="Date Format" type="text"
               notice="Date format to attach at end of the file. Enter php date format default is 'Y-m-d-hi'." component="Firebear_ImportExport/js/form/export-path-file"/>
        <field name="host" id="host" label="Host" type="text" required="true"/>
        <field name="port" id="port" label="Port" type="text" required="true"/>
        <field name="user" id="username" label="Username" type="text" required="true" template="Firebear_ImportExport/form/element/input-user"/>
        <field name="password" id="password" label="Password" type="text" required="true" template="Firebear_ImportExport/form/element/input-pass"/>
    </type>
    <type name="sftp" label="Sftp" modelInstance="Firebear\ImportExport\Model\Source\Type\Sftp" sortOrder="30">
        <field name="file_path" id="file_path" label="File Path" type="text" required="true"
               notice="The file must match the format. Use relative path to Magento installation, e.g. var/import/products.csv (Make sure folder have correct write permissions - 775 , for more details please see Magento 2 Permissions guide)"
               validation="no-whitespace" component="Firebear_ImportExport/js/form/export-path-file"/>
        <field name="date_format" id="date_format" value="Y-m-d-hi" label="Date Format" type="text"
               notice="Date format to attach at end of the file. Enter php date format default is 'Y-m-d-hi'."
               validation="no-whitespace" component="Firebear_ImportExport/js/form/export-path-file"/>
        <field name="host" id="host" label="Host" type="text" required="true"/>
        <field name="port" id="port" label="Port" type="text" required="true"/>
        <field name="username" id="username" label="Username" type="text" required="true" template="Firebear_ImportExport/form/element/input-user"/>
        <field name="password" id="password" label="Password" type="text" required="true" template="Firebear_ImportExport/form/element/input-pass"/>
    </type>
    <type name="google" label="Google Sheet" modelInstance="Firebear\ImportExport\Model\Source\Type\GoogleSheet" sortOrder="40">
        <field name="spreadsheet_id" id="spreadsheet_id" label="Spreadsheet Id" type="text" required="true"
               notice="This value can be taken out from url. Example: Google Sheet url https://docs.google.com/spreadsheets/d/{spreadsheetId}/edit#gid={sheetId}"
               validation="no-whitespace"/>
        <field name="sheet_id" id="sheet_id" label="Sheet Id" type="text" required="true"
               notice="This value can be taken out from url. Example: Google Sheet url https://docs.google.com/spreadsheets/d/{spreadsheetId}/edit#gid={sheetId}"
               validation="no-whitespace"/>
        <field name="signing_key_file" id="signing_key_file" label="Service Account Key File Upload"
               type="text" required="true" component="Firebear_ImportExport/js/form/element/export-signing-key-file-uploader"
               notice="After you create the project in Google Developers Console you will get the *.json file. Open it and copy and paste contents of it to here."
               componentType="fileUploader" template="Firebear_ImportExport/form/element/uploader/uploader" url="import/job/googleKeyload"/>
        <field name="signing_key_file_path" id="signing_key_file_path" label="Service Account Key File Path"
               type="hidden" required="true" component="Firebear_ImportExport/js/form/import-path-file"
               template="Firebear_ImportExport/form/element/hidden"/>
    </type>
    <type name="rest" label="REST API" modelInstance="Firebear\ImportExport\Model\Source\Type\Rest"
          exists="\RestClient" sortOrder="70" depends="json,xml" api="1">
        <field name="request_url" id="request_url" label="API Call URL" type="text"
               required="true" notice="API Call URL" validation="no-whitespace url2"/>
        <field name="request_method" id="request_method"
               label="Request Method" type="text" required="true" formElement="select"
               component="Firebear_ImportExport/js/form/export-rest-select"
               options="Firebear\ImportExport\Model\ExportJob\Source\RestMethod"
               source_options="Firebear\ImportExport\Model\ExportJob\Source\RestMethod"
        />
        <field name="request_options" id="request_options"
               label="JSON Options" type="text" required="true" notice="JSON Options"
               validation="validate-no-empty required-entry"
               component="Firebear_ImportExport/js/form/export-rest-textarea"/>
        <field name="request_body" id="request_body" label="JSON Body Request"
               type="text" required="false" notice="JSON Body Request"
               component="Firebear_ImportExport/js/form/export-rest-textarea"/>
    </type>
    <type name="googledrive" label="Google Drive" modelInstance="Firebear\ImportExport\Model\Source\Type\Googledrive" exists="\Google\Auth\OAuth2" sortOrder="30">
        <field name="file_path" id="file_path" label="File Path" type="text" required="true"
               notice="Specify the export file path on Google Drive, e.g. export/products.csv"
               validation="no-whitespace" component="Firebear_ImportExport/js/form/export-path-file"/>
        <field name="date_format" id="date_format" value="Y-m-d-hi" label="Date Format" type="text"
               notice="Date format to attach at end of the file. Enter php date format default is 'Y-m-d-hi'."
               validation="no-whitespace" component="Firebear_ImportExport/js/form/export-path-file"/>
        <field name="signing_key_file" id="signing_key_file" label="Service Account Key File Upload"
               type="text" required="true" component="Firebear_ImportExport/js/form/element/export-signing-key-file-uploader"
               notice="After you create the project in Google Developers Console you will get the *.json file. Open it and copy and paste contents of it to here."
               componentType="fileUploader" template="Firebear_ImportExport/form/element/uploader/uploader" url="import/job/googleKeyload"/>
        <field name="signing_key_file_path" id="signing_key_file_path" label="Service Account Key File Path"
               type="hidden" required="true" component="Firebear_ImportExport/js/form/import-path-file"
               template="Firebear_ImportExport/form/element/hidden"/>
    </type>
    <type name="onedrive" label="One Drive" modelInstance="Firebear\ImportExport\Model\Source\Type\Onedrive" exists="\Microsoft\Graph\Graph" sortOrder="80">
        <field name="file_path" id="file_path" label="File Path" type="text" required="true"
               notice="Specify the export file path on One Drive, e.g. /export/products.csv"
               validation="no-whitespace" component="Firebear_ImportExport/js/form/export-path-file"/>
    </type>
</config>
